<?xml version="1.0" encoding="UTF-8"?>
<xs:schema xmlns:xs="http://www.w3.org/2001/XMLSchema">

    <xs:element name="studentPortfolio">
        <xs:complexType>
            <xs:sequence>
                <xs:element name="studentInfo">
                    <xs:complexType>
                        <xs:sequence>
                            <xs:element name="lastName" type="xs:string"/>
                            <xs:element name="firstName" type="xs:string"/>
                            <xs:element name="studentID" type="xs:string"/>
                            <xs:element name="program" type="xs:string"/>
                            <xs:element name="yearLevel" type="xs:integer"/>
                        </xs:sequence>
                    </xs:complexType>
                </xs:element>

                <xs:element name="skills">
                    <xs:complexType>
                        <xs:sequence>
                            <xs:element name="skill" type="xs:string" maxOccurs="unbounded"/>
                        </xs:sequence>
                    </xs:complexType>
                </xs:element>

                <xs:element name="projects">
                    <xs:complexType>
                        <xs:sequence>
                            <xs:element name="project" maxOccurs="unbounded">
                                <xs:complexType>
                                    <xs:sequence>
                                        <xs:element name="title" type="xs:string"/>
                                        <xs:element name="description" type="xs:string"/>
                                        <xs:element name="yearMade" type="xs:gYear"/>
                                    </xs:sequence>
                                </xs:complexType>
                            </xs:element>
                        </xs:sequence>
                    </xs:complexType>
                </xs:element>

                <xs:element name="contacts">
                    <xs:complexType>
                        <xs:sequence>
                            <xs:element name="email" type="xs:string"/>
                            <xs:element name="phone" type="xs:string"/>
                            <xs:element name="github" type="xs:anyURI"/>
                        </xs:sequence>
                    </xs:complexType>
                </xs:element>
            </xs:sequence>
        </xs:complexType>
    </xs:element>

</xs:schema>
