<?xml version="1.0" encoding="UTF-8"?>
<!-- Student Portfolio XML File -->
    <?xml-stylesheet type="text/xsl" href="villanueva_transform.xsl"?>
<studentPortfolio xmlns:xsi="http://www.w3.org/2001/XMLSchema-instance"
    xsi:noNamespaceSchemaLocation="villanueva_schema.xsd">

    <!-- Basic Information -->
    <studentInfo>
        <lastName>Villanueva</lastName>
        <firstName>Dean</firstName>
        <studentID>2022300721</studentID>
        <program>BS Information Technology</program>
        <yearLevel>4</yearLevel>
    </studentInfo>

    <!-- Skills Section -->
    <skills>
        <skill>Web Development</skill>
        <skill>Mobile App Development</skill>
        <skill>Database Management</skill>
        <skill>UI/UX Design</skill>
    </skills>

    <!-- Projects Done by the Student -->
    <projects>
        <project>
            <title>Historical RPG Game</title>
            <description>
                A turn-based RPG created to help students learn about the Battle of Mactan
                in a fun and interactive way.
            </description>
            <yearMade>2025</yearMade>
        </project>

        <project>
            <title>ColleGo App</title>
            <description>
                A campus navigation app made for helping students locate food stalls,
                printing services, and school supply stores.
            </description>
            <yearMade>2024</yearMade>
        </project>
    </projects>

    <!-- Student Contact Details -->
    <contacts>
        <email>xczrei@google.com</email>
        <phone>09128588860</phone>
        <github>https://github.com/xczREI</github>
    </contacts>

</studentPortfolio>
